{
  "schema_version": 1,
  "review_id": "task1_live_pre_task2_review_20260719",
  "reviewed_at": "2026-07-19T23:16:36Z",
  "reviewer_kind": "ai_product_development_review",
  "source": {
    "local_artifact": "tmp/memory_v3_baselines/memory_v3_live_pre_task2_20260720.json",
    "artifact_committed": false,
    "sha256": "76340fa48e9c9411ec707dff0bff74552075e89ad7315b02187a559bdd800c17",
    "run_id": "memory_v3_baseline_20260719T231410Z",
    "fixture_sha256": "5fc000902bb95613657e1bb3dec96908efa5790b580339899e367b4b647a6b0b",
    "provider": "sarvam",
    "model": "sarvam-30b",
    "response_arm_count": 51,
    "provider_error_count": 0
  },
  "gates": {
    "task2_schema_implementation": "pass",
    "runtime_cutover": "fail",
    "reason": "The live evidence is sufficient to design the V3 ledger and projections, but unchanged V2 passed only 5 of 17 response rubrics and even oracle memory passed only 12 of 17. Prompt-policy and context-selection defects must be fixed and re-evaluated before runtime cutover."
  },
  "query_reviews": [
    {
      "scenario_id": "explicit_name_grounded_v3",
      "query_id": "query_name_recall",
      "arms": {
        "no_memory": {"result": "fail", "failure_modes": ["missing_required_memory", "unnecessary_question"], "note": "Did not answer Aditi and added a question."},
        "v2": {"result": "pass", "failure_modes": [], "note": "Direct V2 fact response answered Aditi accurately and briefly."},
        "oracle": {"result": "fail", "failure_modes": ["speaker_role_confusion"], "note": "Said 'I am Aditi', converting a user attribute into the assistant's identity."}
      }
    },
    {
      "scenario_id": "assistant_name_contamination_v3",
      "query_id": "query_contaminated_name",
      "arms": {
        "no_memory": {"result": "pass", "failure_modes": [], "note": "Correctly said the name was unknown and did not use Rahul."},
        "v2": {"result": "pass", "failure_modes": [], "note": "Correctly abstained; assistant text did not become user evidence."},
        "oracle": {"result": "pass", "failure_modes": [], "note": "Correctly stated that the user had not provided a name."}
      }
    },
    {
      "scenario_id": "mixed_script_preference_v3",
      "query_id": "query_support_preference",
      "arms": {
        "no_memory": {"result": "fail", "failure_modes": ["forced_question"], "note": "Acknowledged the user but immediately asked a question after being told to just listen."},
        "v2": {"result": "fail", "failure_modes": ["forced_question"], "note": "Asked two questions instead of honoring listen-only support."},
        "oracle": {"result": "fail", "failure_modes": ["forced_question"], "note": "The oracle plan said not to force a question, but the response still prompted the user."}
      }
    },
    {
      "scenario_id": "event_and_assessment_v3",
      "query_id": "query_interview_experience",
      "arms": {
        "no_memory": {"result": "fail", "failure_modes": ["missing_required_memory", "invented_detail"], "note": "Invented that the interview was challenging and omitted the repeated interruptions and explicit dislike."},
        "v2": {"result": "fail", "failure_modes": ["missing_required_memory"], "note": "Said the experience was unknown and asked the user to repeat it."},
        "oracle": {"result": "pass", "failure_modes": [], "note": "Accurately recalled the design interview, interruptions, and negative assessment."}
      }
    },
    {
      "scenario_id": "sensitive_candidate_ephemeral_v3",
      "query_id": "query_sensitive_recall",
      "arms": {
        "no_memory": {"result": "fail", "failure_modes": ["sensitive_abstention_failure", "invented_detail"], "note": "Did not explain non-retention and invented a phone/card linkage."},
        "v2": {"result": "fail", "failure_modes": ["sensitive_abstention_failure", "invented_detail"], "note": "Falsely claimed a bank PIN is saved in phone or email and did not explain credential non-retention."},
        "oracle": {"result": "fail", "failure_modes": ["sensitive_abstention_failure", "unnecessary_question"], "note": "Said it could not tell the PIN rather than that it was not retained, then asked for the bank name."}
      }
    },
    {
      "scenario_id": "identity_correction_timeline_v3",
      "query_id": "query_current_corrected_name",
      "arms": {
        "no_memory": {"result": "fail", "failure_modes": ["missing_required_memory"], "note": "Could not answer the corrected current name."},
        "v2": {"result": "fail", "failure_modes": ["missing_required_memory"], "note": "Could not retrieve the corrected current name."},
        "oracle": {"result": "pass", "failure_modes": [], "note": "Answered Diya as current and did not surface Riya."}
      }
    },
    {
      "scenario_id": "job_change_timeline_v3",
      "query_id": "query_job_timeline",
      "arms": {
        "no_memory": {"result": "fail", "failure_modes": ["missing_required_memory"], "note": "Could not provide the requested job change."},
        "v2": {"result": "fail", "failure_modes": ["missing_required_memory", "invented_detail"], "note": "Invented that no job change occurred."},
        "oracle": {"result": "pass", "failure_modes": [], "note": "Correctly summarized BluePeak as previous and Northstar as current."}
      }
    },
    {
      "scenario_id": "open_thread_result_closure_v3",
      "query_id": "query_scholarship_outcome",
      "arms": {
        "no_memory": {"result": "fail", "failure_modes": ["stale_open_thread", "invented_detail"], "note": "Incorrectly asserted the result was still pending."},
        "v2": {"result": "fail", "failure_modes": ["missing_required_memory", "asks_user_to_repeat"], "note": "Asked when the result arrived instead of recalling the selection."},
        "oracle": {"result": "pass", "failure_modes": [], "note": "Recalled the selection and celebrated briefly."}
      }
    },
    {
      "scenario_id": "paraphrased_episode_recall_v3",
      "query_id": "query_seaside_trip",
      "arms": {
        "no_memory": {"result": "fail", "failure_modes": ["missing_required_memory", "speculation"], "note": "Generalized about tension and did not recall the Goa episode or mechanic."},
        "v2": {"result": "fail", "failure_modes": ["missing_required_memory", "invented_detail"], "note": "Invented a technical issue and engine sounds while omitting the local mechanic."},
        "oracle": {"result": "pass", "failure_modes": [], "note": "Connected the paraphrase to Goa, the breakdown, and the local mechanic."}
      }
    },
    {
      "scenario_id": "implicit_pronoun_followup_v3",
      "query_id": "query_pronoun_exam",
      "arms": {
        "no_memory": {"result": "fail", "failure_modes": ["recent_context_selection_failure"], "note": "Only the assistant acknowledgement survived recent-turn selection, so Sunday was absent and the answer failed."},
        "v2": {"result": "fail", "failure_modes": ["recent_context_selection_failure"], "note": "Like no-memory, selected the assistant acknowledgement but omitted the user turn containing Sunday."},
        "oracle": {"result": "pass", "failure_modes": [], "note": "Resolved the pronoun and answered Sunday from the trusted use plan."}
      }
    },
    {
      "scenario_id": "historical_change_query_v3",
      "query_id": "query_support_change",
      "arms": {
        "no_memory": {"result": "fail", "failure_modes": ["missing_required_memory", "invented_detail"], "note": "Invented that no support-preference change occurred."},
        "v2": {"result": "fail", "failure_modes": ["missing_required_memory", "invented_detail"], "note": "Invented that everything remained unchanged."},
        "oracle": {"result": "fail", "failure_modes": ["incomplete_timeline", "unnecessary_question"], "note": "Both historical and current claims were present, but the answer stated only the current preference and added a question contrary to the plan."}
      }
    },
    {
      "scenario_id": "vague_mood_abstention_v3",
      "query_id": "query_vague_mood",
      "arms": {
        "no_memory": {"result": "pass", "failure_modes": [], "note": "Stayed with the current vague feeling without injecting unrelated memories."},
        "v2": {"result": "pass", "failure_modes": [], "note": "Correctly avoided unrelated food and running memories."},
        "oracle": {"result": "pass", "failure_modes": [], "note": "Responded to the present feeling without diagnosis or memory injection."}
      }
    },
    {
      "scenario_id": "vector_nearest_below_threshold_v3",
      "query_id": "query_live_cricket_score",
      "arms": {
        "no_memory": {"result": "pass", "failure_modes": [], "note": "Honestly stated that live score data was unavailable."},
        "v2": {"result": "fail", "failure_modes": ["false_live_capability"], "note": "Suggested it could see what was happening live after saying it did not remember the score."},
        "oracle": {"result": "pass", "failure_modes": [], "note": "Correctly stated that no real-time score data was available."}
      }
    },
    {
      "scenario_id": "silent_support_preference_v3",
      "query_id": "query_overwhelmed_silent",
      "arms": {
        "no_memory": {"result": "fail", "failure_modes": ["forced_question"], "note": "Validated the feeling but required the user to identify the worst problem."},
        "v2": {"result": "fail", "failure_modes": ["forced_question"], "note": "Asked a follow-up instead of offering quiet, non-solution support."},
        "oracle": {"result": "fail", "failure_modes": ["forced_question"], "note": "Even with the silent-support preference, the core prompt's question habit dominated."}
      }
    },
    {
      "scenario_id": "validation_without_question_v3",
      "query_id": "query_quiet_presence",
      "arms": {
        "no_memory": {"result": "fail", "failure_modes": ["explicit_no_question_violation"], "note": "Promised no questions and then immediately asked one."},